country,countryCode,city,isp,org,as,query,valid
Thailand,TH,Nonthaburi,National Telecom Public Company Limited,"ReadyIDC Co., Ltd",AS9335 National Telecom Public Company Limited,45.150.131.246,True
Thailand,TH,Nong Muang,READYIDC CO,"ReadyIDC CO., LTD.","AS56309 Siamdata Communication Co.,Ltd.",117.18.127.37,True
Thailand,TH,Bangkok,M247 Europe SRL,3NT SOLUTIONS LLP,AS9009 M247 Europe SRL,38.244.150.113,True
Thailand,TH,Bangkok,"Alibaba (US) Technology Co., Ltd.",Alibaba.com Singapore E-Commerce Private Limited,"AS45102 Alibaba (US) Technology Co., Ltd.",8.213.199.128,True
Thailand,TH,Bangkok,Alibaba.com LLC,"Delta Centric LLC, Zenlayer Inc","AS45102 Alibaba (US) Technology Co., Ltd.",47.81.9.160,True
Thailand,TH,Nong Muang,READYIDC CO,"ReadyIDC CO., LTD.","AS56309 Siamdata Communication Co.,Ltd.",117.18.127.3,True
Thailand,TH,Bangkok,"Siamdata Communication Co., ltd.","ReadyIDC Co., Ltd.","AS56309 Siamdata Communication Co.,Ltd.",43.249.33.117,True
Thailand,TH,Bangkok,Aceville Pte.ltd,,"AS132203 Tencent Building, Kejizhongyi Avenue",43.133.110.81,True
