country,countryCode,city,isp,org,as,query,valid
Switzerland,CH,Zurich,Datasource AG,,AS51395 Datasource AG,91.192.102.170,True
Switzerland,CH,Utzenstorf,Solar Communications GmbH,Solar Communications GmbH,AS197988 Solar Communications GmbH,95.183.51.10,True
Switzerland,CH,Zurich,Global Connectivity Solutions LLP,Global Connectivity Solutions LLP,AS215540 GLOBAL CONNECTIVITY SOLUTIONS LLP,45.95.232.18,True
Switzerland,CH,Bern,Private Layer INC,3NT SOLUTIONS LLP,AS51852 Private Layer INC,38.180.84.25,True
Switzerland,CH,Zurich,Global Connectivity Solutions LLP,Global Connectivity Solutions LLP,AS215540 GLOBAL CONNECTIVITY SOLUTIONS LLP,45.95.232.243,True
Switzerland,CH,Geneva,Green Floid LLC,Friendhosting LTD,AS204957 GREEN FLOID LLC,91.90.193.54,True
