country,countryCode,city,isp,org,as,query,valid
Türkiye,TR,Istanbul,Global Connectivity Solutions LLP,Global Connectivity Solutions LLP,AS215540 GLOBAL CONNECTIVITY SOLUTIONS LLP,185.39.204.117,True
Turkey,TR,Istanbul,Sunucun Bilgi Iletisim Teknolojileri ve Ticaret Ltd. Sti.,Sunucun Bilgi Iletisim Teknolojileri Tic Ltd Sti,AS197450 Sunucun Bilgi Iletisim Teknolojileri ve Ticaret Ltd. Sti.,185.113.223.183,True
Türkiye,TR,Istanbul,Baxet Group Inc.,Baxet Group Inc,AS26383 Baxet Group Inc.,212.192.6.219,True
Turkey,TR,Istanbul,PH Bilisim Teknolojileri Limited Sirketi,Yunus Emre Atilgan Poyraz Hosting,AS210574 PH Bilisim Teknolojileri Limited Sirketi,141.98.115.65,True
Turkey,TR,Istanbul,PH Bilisim Teknolojileri Limited Sirketi,Yunus Emre Atilgan Poyraz Hosting,AS210574 PH Bilisim Teknolojileri Limited Sirketi,141.98.115.64,True
Türkiye,TR,Ankara,365.partners INC,Plant Holding GMBH,AS198178 365.partners INC,138.124.107.101,True
