country,countryCode,city,isp,org,as,query,valid
Turkey,TR,Yakuplu,TradeZone LLC,Geo Teknoloji,AS201575 TradeZone LLC,188.132.192.194,True
Turkey,TR,Istanbul,PH Bilisim Teknolojileri Limited Sirketi,Yunus Emre Atilgan Poyraz Hosting,AS210574 PH Bilisim Teknolojileri Limited Sirketi,141.98.115.65,True
Türkiye,TR,Istanbul,Global Connectivity Solutions LLP,Global Connectivity Solutions LLP,AS215540 GLOBAL CONNECTIVITY SOLUTIONS LLP,185.39.204.117,True
Türkiye,TR,Istanbul,Baxet Group Inc.,Baxet Group Inc,AS26383 Baxet Group Inc.,212.192.6.219,True
Turkey,TR,Izmir,WorkTitans B.V.,WorkTitans B.V,AS209847 WorkTitans B.V.,194.116.190.199,True
Turkey,TR,Istanbul,Sunucun Bilgi Iletisim Teknolojileri ve Ticaret Ltd. Sti.,Sunucun Bilgi Iletisim Teknolojileri Tic Ltd Sti,AS197450 Sunucun Bilgi Iletisim Teknolojileri ve Ticaret Ltd. Sti.,185.113.223.183,True
Turkey,TR,Istanbul,PH Bilisim Teknolojileri Limited Sirketi,Yunus Emre Atilgan Poyraz Hosting,AS210574 PH Bilisim Teknolojileri Limited Sirketi,141.98.115.64,True
Turkey,TR,Istanbul,Superonline Iletisim Hizmetleri A.S,Turkcell Iletisim Hizmetleri,AS34984 Superonline Iletisim Hizmetleri A.S.,45.67.202.88,True
